{"cleanup_evidence":{"local_listeners_remaining":0,"local_processes_reaped":true,"remote_listeners_remaining":0,"remote_process_groups_reaped":true,"remote_temp_path_removed":true},"cleanup_status":"verified","contract":{"payload_bytes":1200,"payload_prepared":true,"payload_sha256":"655a3ef0465a9f30fddf25f4dde0c19a05c6f9069b83961800c1944165955273","runs_per_implementation":5},"experiment_id":"hy2-owned-lab-paired","failure_stage":"hy2-1-failed","git_commit":"13da094f4e2541cc2d047113cc1002120817ced9","samples":[{"application_bytes":1200,"client_diagnostic":null,"cpu_system_seconds":0.003151,"cpu_user_seconds":0.001889,"elapsed_seconds":0.29,"exit_code":0,"failure_stage":null,"failures":0,"fd_count":5,"implementation":"nekomusume","name":"nekomusume-1","payload_sha256":"655a3ef0465a9f30fddf25f4dde0c19a05c6f9069b83961800c1944165955273","rss_kib":10768,"run":1,"wire_bytes":null},{"application_bytes":0,"client_diagnostic":{"bundle_bytes":699,"bundle_sha256":"bad8734ebcd73637d64ac10c155b22110d5dd9931463f19f801b825b786673c3","category":"unknown","ended_at":"2026-09-08T16:13:18Z","last_success_source":"harness","last_success_stage":"client_started","started_at":"2026-09-08T16:13:17Z"},"cpu_system_seconds":0.091597,"cpu_user_seconds":0.044474,"elapsed_seconds":0.29,"exit_code":1,"failure_stage":"client_exit","failures":1,"fd_count":13,"implementation":"hy2","name":"hy2-1","payload_sha256":null,"rss_kib":24368,"run":1,"wire_bytes":null}],"schema":"nekomusume.benchmark-blocked-harness.v1","status":"BLOCKED_HARNESS"}
