{"cleanup_evidence":{"local_listeners_remaining":0,"local_processes_reaped":true,"remote_listeners_remaining":1,"remote_process_groups_reaped":false,"remote_temp_path_removed":null},"cleanup_status":"failed","contract":{"payload_bytes":1200,"payload_prepared":true,"payload_sha256":"655a3ef0465a9f30fddf25f4dde0c19a05c6f9069b83961800c1944165955273","runs_per_implementation":5},"experiment_id":"hy2-owned-lab-paired","failure_stage":"setup","git_commit":"bc38d06bfc0c19d0ec26fe2d0f5484202565ec18","samples":[],"schema":"nekomusume.benchmark-blocked-harness.v1","status":"BLOCKED_HARNESS"}
