{"cleanup_evidence":{"local_listeners_remaining":0,"local_processes_reaped":true,"remote_listeners_remaining":0,"remote_process_groups_reaped":false,"remote_temp_path_removed":true},"cleanup_status":"failed","contract":{"payload_bytes":1200,"payload_prepared":true,"payload_sha256":"655a3ef0465a9f30fddf25f4dde0c19a05c6f9069b83961800c1944165955273","runs_per_implementation":5},"experiment_id":"hy2-owned-lab-paired","failure_stage":"hy2-1-failed","git_commit":"3d545859e06690c528a717015c9b7023d05ea420","samples":[{"application_bytes":1200,"cpu_system_seconds":0.005158,"cpu_user_seconds":0.02579,"elapsed_seconds":0.33,"exit_code":0,"failure_stage":null,"failures":0,"fd_count":5,"implementation":"nekomusume","name":"nekomusume-1","payload_sha256":"655a3ef0465a9f30fddf25f4dde0c19a05c6f9069b83961800c1944165955273","rss_kib":10752,"run":1,"wire_bytes":null},{"application_bytes":0,"cpu_system_seconds":0.093187,"cpu_user_seconds":0.035202,"elapsed_seconds":0.27,"exit_code":1,"failure_stage":"client_exit","failures":1,"fd_count":13,"implementation":"hy2","name":"hy2-1","payload_sha256":null,"rss_kib":24664,"run":1,"wire_bytes":null}],"schema":"nekomusume.benchmark-blocked-harness.v1","status":"BLOCKED_HARNESS"}
